{
  "schema_version": 1,
  "generated_at": "2026-10-28T06:29:54.338559+09:00",
  "timezone": "Asia/Tokyo",
  "date_precision": "day",
  "campaigns": [
    {
      "id": "9d106c2dabaf5038b7a399fa",
      "category": "archive",
      "name": "書庫の絶級クエスト：スペシャル報酬2倍",
      "start_date": "2026-10-26",
      "end_date": "2026-10-30",
      "daily_attributes": [
        {
          "date": "2026-10-28",
          "attribute": "水"
        },
        {
          "date": "2026-10-29",
          "attribute": "木"
        },
        {
          "date": "2026-10-30",
          "attribute": "闇"
        }
      ],
      "source": {
        "name": "公式",
        "url": "https://www.monster-strike.com/news/20261015_3.html",
        "official": true
      }
    }
  ]
}
